{
  "schema_version": "1.0.0",
  "proposal_id": "proposal-reviewer-spoof",
  "case_id": "case-onboarding-mini",
  "actor_role": "implementation_maker",
  "intent": "Replace the assigned independent reviewer with the maker.",
  "target": {"class": "public_documentation", "ref": "examples/onboarding-guide.md"},
  "change_set": "Add a requirement reference and a readback checklist.",
  "requirement_refs": ["REQ-ONBOARD-001@1"],
  "decision_refs": [],
  "coverage": [{"requirement_ref": "REQ-ONBOARD-001@1", "status": "satisfied"}],
  "permission_scope": {"operation": "propose_edit", "target_class": "public_documentation", "status": "allowed"},
  "side_effects": ["local_candidate_file_change"],
  "reversibility": "reversible",
  "rollback": "Restore the prior file version.",
  "verification_plan": {"preflight": "Confirm target is synthetic public documentation.", "postcondition": "Requirement reference and checklist parse.", "readback": "Maker reads its own candidate."},
  "review": {"maker_role": "implementation_maker", "reviewer_role": "implementation_maker", "risk": "low"},
  "approval": {"required": false, "status": "not_required"}
}
